<!ENTITY % att-bool '( TRUE | FALSE )' >

<!-- MODE element -->
<!ELEMENT ACTIONS ( ACTION+ ) >

<!-- ACTION element -->
<!ELEMENT ACTION ( ACTION_PERFORMED | IS_SELECTED )+ >
<!ATTLIST ACTION
	NAME CDATA #REQUIRED
	NO_REPEAT %att-bool; "FALSE"
	NO_RECORD %att-bool; "FALSE" >

<!-- ACTION children -->
<!ELEMENT ACTION_PERFORMED ( #PCDATA ) >
<!ELEMENT IS_SELECTED ( #PCDATA ) >
